,pros,negs,profession,day,month,year
51,"Good focus on consultant wellbeing, Good company culture, Efforts in ensuring good work life balance.","Different benefits for USDC and CORE. Not as easy to grow laterally, they try to make you stay in one portfolio and offer ""opportunities"" to grow outside but not difficult to transfer.",Solution Specialist,14,Nov,2022
52,A great starting point for a career,No cons at the moment,Tax Consultant I,25,Nov,2022
53,"Work life balance (I am only speaking on my personal experience) has been amazing. Deloitte really values allowing employees to work remote and participate in in-person events when they want to. 

The benefits at Deloitte are great for the most part. Benefits for new parents are incredible as well as a well-being subsidy which is $1k a year (taxable) anything wellness related

So many incredible resources","The 401k match isn't the best but it isn't horrible either 
Such a big place that you really have to try hard to remain on people's radar for promotion, etc. 
Sometimes a lack of direction on engagements (but this is entirely dependent on who you work with)",Consultant,8,Sep,2022
54,Wellness subsidy Firm holiday Incentives for TS clearances,"Feels like a target is on your back if you’re on the bench, but they want you to find a project that aligns to your goals and sometimes those aren’t available.",GPS Consultant,16,Nov,2022
55,"Benefits, training, coaching, professional development, networking growing",Requires you to network to get on a project once you get hired,Risk and Advisory Analyst,22,Nov,2022
56,"Salary, benefits, WFH, fully remote, well-being subsidy",Working on an operations team at Deloitte will take away any and all social life,Solution Delivery Analyst,16,Nov,2022
57,Good for Senior Tax Consultant,long hour is probably the only con,Senior Tax Consultant,23,Nov,2022
58,Good pay Flexible work environment (hybrid/WFH) Healthy corporate culture,Long and inconsistent work hours at times,Analyst,23,Nov,2022
59,Opportunity to work with the brightest people and solve complex client challenges.,Can get hectic at times with very minimal work life balance,Senior Manager,19,Nov,2022
60,Opportunity to work with the brightest people and solve complex client challenges.,Can get hectic at times with very minimal work life balance,Senior Manager,19,Nov,2022
61,Great people to work with Great Benefits,Long work hours Typical Corporate Culture,Data Management Analyst,21,Nov,2022
62,Deloitte's reputation. Upper management was initially supportive. Opportunities for training and doing interesting projects.,"No awareness or support for Neurodiversity. Lack of diversity in employee populations. My boss and team changed the output of my research to keep upper management feeling that Deloitte was on top of the competition and to cover the shoddy work they had done in previous years. There was strong retaliation against my speaking up, and I had to spend months fighting fake low-performance accusations by my manager and working 12-14h/days for months until I was exhausted and needed intensive therapy.","Manager, Strategy",4,Nov,2022
63,Lots of opportunities to try new types of work in different industries,Leadership and low compensation for the hours,Consultant,20,Nov,2022
64,Energetic environment High tech Good benefits,Long hours On you to raise flags if your schedule is impossible,Tax Senior,21,Nov,2022
65,work life balance is amazing! beenfits and pay make it even better!,The process of finding another project is not ideal.,Consultant,16,Nov,2022
66,"For the average college graduate, it's not a bad first job. The pay is better than a lot of small companies at career fairs, somewhere around 60k for the past couple of years. USDC teammates are mostly friendly and down to earth. A lot of H1B & contract workers - the USDC is basically the intermediary between offshore employees and ""core"" D. The consulting structure affords you the opportunity to move between projects, which keeps the burn-out at bay without the stress of finding new employment.","Because the USDC is Deloitte's ""on-shore offshoring"", you are a second class citizen to ""core"" Deloitte. Benefits are not as strong, for example: pay is roughly 25% lower on average; core employees receive 16 weeks of baby leave, while USDC new hires receive 2 weeks; there is no pension program; I believe PTO is accrued slightly slower; you do not attend Deloitte's ""university"". Core employees are generally unaware of these differences. In some cases, core employees will treat USDC as ""the help.""",Solution Analyst,10,Apr,2022
67,1000 well being subsidy which you can use most in everything.,"Too long hours, competitive environment.",Tax Consultant I,20,Nov,2022
68,-Benefits -Project Variety -Smart and awesome Colleagues -Travel every now and then dependent on project,-Long hours at times -Work Life Balance can sometimes become a hurdle -Needy and Pushy Clients at times -45+ hours of work is required,Cyber Risk Analyst,9,Nov,2022
69,Great Internship and people. You get a lot of responsibility,"No cons at all, I enjoyed my experience here",Summer Intern,18,Nov,2022
70,Structured firm and good training in place. There are a lot of smart people you can connect with. Inclusive culture. People are the reason why Deloitte is a decent company.,"It is a big firm - your experience will largely depends on the project you get on. Your career also solely depends on how proactive you are in terms of looking for the type if work you want to do and your efforts on connecting with leadership. Since it's a structure firm, there is a sense of hierarchy that causes office politics. It is exhausting that if you want to get promoted you have to a lot outside of project work.",Consultant,7,Sep,2022
71,"Opportunities to grow and develop as a project manager. Course availability. Supervisors, managers, and Managing directors that want to see people progress in their careers.","I understand Deloitte does a lot of auditing and has to maintain a higher ethical standard. I feel like they get intrusive in the personal finances of employees and dependents. As a non-auditing project delivery employee, it made little sense to me.",Project Delivery Specialist II,26,Oct,2022
72,Good company with good brand name in the market,Large firm so some projects are great and some aren't as good.,GPS Consultant,16,Nov,2022
73,People Culture Variety Opportunity Innovative,Workload Salary Political Sales pressure / targets Competitive,Director Risk Advisory,16,Nov,2022
74,"Ample PTO with decent rollover capability
Corporate Amex Usage
Maternity leave is 24-26 weeks (!!) 
Second phone
The first time you go to DU
Variety of projects and clients 
Social events","Attracts the competitive type, lack of transparency in year end reviews, endless comparison to peers. 401k match is 1.5%. To succeed (I.e., raises and promotion) its more what you do to help PPMDs than clients. 

I can’t recommend Deloitte to any level higher than a senior consultant. The politics coming in as an experienced hire any higher will make it difficult to immerse and succeed. 

I left for a competitor and the easiest way I describe the difference is that at my current employer I am recognized for the work I do; while at Deloitte I was constantly reminded of how much more work I could be doing.",Senior Consultant,4,Aug,2022
75,Good company culture and people relationship.,Working hours varies a lot,Consultant,19,Nov,2022
76,Not bad depending on project,It can get bad depending on project,Consultant,20,Nov,2022
77,I have not started working yet however everyone I have met so far has been extremely kind and helpful!,Can’t speak to this yet,Strategy Analyst,15,Nov,2022
78,The firm provides really good benefits,is is an okay form,Analyst,17,Nov,2022
79,"Good work/life balance, remote work options, competent coworkers","Benefits could be better, expected to do free work on top of client responsibilities, salary could be better",Consultant,14,Nov,2022
80,Incredible growth opportunities within the consulting space for young people. Tons of great resources and intelligent driven workforce.,Pockets of toxic leaders that the overarching organization refuses to check or correct due to profitability of these leaders. This leads to an inconsistent employee experience across the organization where some leaders are absolutely stellar and others quickly burn out and abuse employees.,Manager,19,Nov,2022
81,Good place to work for anyone,Benefits are not the best,Project Manager,18,Nov,2022
82,Great place to work. Highly recommend,None that I can think of,Senior Consultant,18,Nov,2022
83,"At Deloitte, you will have the opportunity to see whatever you like. All you need to do is ask. If you have a strong mental tenacity, you will fit in well here.","This is a great place to start, but the work life balance is truly lacking and it is evident in the culture. Expectations are that you must be able to work overtime at the drop of a hat.",Senior Audit Associate,23,Oct,2022
84,lots of training complex projects,high stress working environment team politics,Audit Associate,17,Nov,2022
85,They care about your well being.,Could have better performance process.,Audit Senior,16,Nov,2022
86,good professional company to work to start your career,did not find any cons at this company,Software Developer,15,Nov,2022
87,Offers sabbatical after 2 years of being a high performer,Pressure to not report hours worked over 45 hr/week,Consultant,10,Nov,2022
88,The people are great here,"The culture, work life balance",Audit Senior,15,Nov,2022
89,Hard working professionals and smart individuals,Impersonal remote environment with no room for mentorship,Senior Consultant,15,Nov,2022
90,Hard working professionals and smart individuals,Impersonal remote environment with no room for mentorship,Senior Consultant,15,Nov,2022
91,There isn't much good going on here.,Coworkers and management pretend to act nice but they always throw you under the bus. Lack of professionalism. Managers were very disrespectful to me and colleagues. (especially in public settings),Solution Analyst,30,Nov,2022
92,learning opportunities for both soft and hard skills leadership opportunities,"long hours the expectation of ""performing at the next level"" for promotion sometimes feel like performance punishment",Advisory Consultant,9,Nov,2022
93,"work life balance, learning environment","pressure, pay is low but work is heavy",Associate,14,Nov,2022
94,"Great pay, benefits, and culture","Hours, work life balanced, boring content, inability to move across the company ( government to commercial )",Advertising,8,Nov,2022
95,"-Flexible work environment -Plenty of learning resources -Promoters of diversity, equality, and inclusion -Good entry level to company",-May need to adjust working hours for clients based on time zone,Executive Coordinator,29,Oct,2022
96,"Good salary, opportunities to grow.",All depends on your network,Consultant,14,Nov,2022
97,Most colleagues are highly skilled and a joy to work with. The pay/promotion cycle is transparent. There are so many things you can try your hand at.,Obsession with utilization percentage means that any professed lip service they give to work-life balance isn't genuine. Some of the PPMDs are really out of touch and treat people below them poorly. The culture can feel a bit cult-ey at times - is anyone actually that excited to come to work?,Advisory Consultant,6,Nov,2022
98,"WFH, Well-being subsidy, Culture, Projects",Doesn't have a huge pool of opportunities for every career field like the advertise,Solutions Specialist,8,Nov,2022
99,Good benefits and work life balance,I don't find any cons here.,Data Analytics Manager,11,Nov,2022
100,Good progress in general speaking,Easy to get lost in company,Manager,14,Nov,2022
101,"Lots of opportunities. Great networking/connection. Professional and personal growth. Pressure managing skill, etc.",Heavy workload. Long hours. Short of guidance.,Audit & Assurance Senior Associate,8,Nov,2022
102,Great Experience for future opportunities,Long hours during busy season,Audit Senior Assistant,10,Nov,2022
103,Flexible work environment and largely driven by the engagement,Expected to work on extra stuff out side of your assigned engagement,Solution Delivery Manager,8,Nov,2022
104,"The benefits are spectacular. Based on your project team, team dynamic and leadership, you can find yourself in a great position to succeed. You can also find your niche based on your interests and skillsets which make launching your career here spectacular.",It is a grind. You have to carve your career and create those meaningful connections that will set you up for success. You also need to be assertive in vouching for your salary and performance; it has to be earned and performance is critical to changing minds.,Strategy Consultant,5,Oct,2022
105,High profile clients across many industries,"The most arrogant culture I've ever encountered. If you don't do things the ""Deloitte way"" then they'll think you're stupid and won't staff you on projects regardless of your experience. Of course, the people who expect the ""Deloitte way"" have never known other more effective ways of working because the culture expects you to conform to their way of thinking. Many of my ex-colleagues agree after they've left Deloitte and experienced other companies.",Senior Manager,16,Nov,2022
106,"Lots of perks, value well being and a myriad of educational opportunities",Ver few cons. Standard corporate expectations as everywhere else,IT Governance Lead,7,Nov,2022
107,"- Choose your Engagement (who you work with, what you do)
- Type A Personalities thrive (people who are self-driven)
- People generally seem to care about each other (but only if you stay in front of them)
- Decent Perks/Subsidies/Benefits (Work Phone, $500 Tech bonus, $1000 Well-being, $1000 commuting balance)","- If you're not Type A expect to fall through the cracks/fall behind
- Networking/Socializing is sort of a must, you have to talk/communicate a lot
- Some office politics
- You need to really be self-driven to succeed",Risk and Financial Advisory Analyst,20,Sep,2022
108,Good overall benefits and wellbeing package.,"Feels like your work is not being appreciated, no work life balance, the culture is bad.",Solution Specialist,25,Nov,2022
109,Great place to work and benefits,Work life balance is poor,Solution Analyst,10,Nov,2022
110,Amazing company to work with,there is none that i could think of,Anonymous Employee,11,Nov,2022
111,- Exposure to lots of different and fascinating work being done across the firm. - Countless supportive and friendly folks to work with - Fast career and personal development,"- Can be difficult to get into the group that you want - Red tape is extensive - Decisions are made by partners relating to almost all things including staffing, promotins, grad school etc.",Consultant,19,Oct,2022
112,good work culture and snacks,long hours poor management poor planning,Digital Marketing,13,Nov,2022
113,Deloitte is truly a great place to work. The care about their employees and will work to create the most productive and pleasant working experience for employees and contractors alike. Highly recommended.,Takes a while to get completely on- board because there are many processes to learn.,Information Technology,28,Oct,2022
114,-College Hire -Good benefits and salary,-Not really -No relocation help,Business Technology Analyst,10,Nov,2022
115,Good benefits and time off,No real cons working with Deloitte,SOC Analyst,11,Nov,2022
116,Great benefits and career advancement opportunities,The team you're on will completely steer your experience and where you can go next within the company.,Audit Senior Associate,3,Nov,2022
117,Good company to work for,It was difficult interview process,Salesforce Administrator,11,Nov,2022
118,"Great leaders, great clients, great projects",Experience is very project and team dependent,Senior Consultant,11,Nov,2022
119,"Great culture, interesting clients, good team, perks","Long hours, lack of resources",Senior Tax Consultant,11,Nov,2022
120,Gives you the freedom to take your career where you want it to go.,If you aren't proactive you will get placed on projects you might not want to be on.,Senior Consultant Risk Advisory,2,Nov,2022
121,you will learn a lot from smart people.,you are under paid in comparison to major consulting firms and long hours.,Prefer Not To Say,22,Nov,2022
122,This is a good company with opportunities to learn,"If you can BS confidently, growth is guaranteed",Senior Manager,3,Nov,2022
123,"Excellent pay and benefits, this is about the only thing going for Deloitte Consulting",No rest for the weary. They take full advantage of you and expect more than a standard work week. They expect full 45+ hrs per week on client projects and you must also put in additional hours for company growth. With a minimum of 90% performance is expected.,Senior Consultant,30,Oct,2022
124,Great group of people to work with,Corporate politics and hierarchical structure,Audit Senior,9,Nov,2022
125,Lots of training and development opportunities and good work-life balance (depending on the team/client of course). Lots of smart people to work with and a great place to learn new things. A diverse workplace. Lots of networking opportuniteis.,The company is so big that it is hard to feel connected or find relevant people/teams. It seems there's a culture that people don't turn on cameras during meetings most of the time. Very poor support for immigration and restrictive immigration policies.,Senior Research Analyst I,28,Sep,2022
126,"Great brand in consulting, pays well, heavy focus on apprenticeship based model.","Long working hours, travel, and demanding projects",Senior Manager,7,Nov,2022
127,I started my career at Deloitte and I strongly believe it was the best place to do that. It gave me the opportunity to explore different industries while continuing to learn at a fast pace,It is a lot of hours during the week but manageable,Consulting Senior Consultant,21,Oct,2022
128,"Good PTO and decent benefits, smart people, understanding teams","big firm, a bit underpaid,",Consultant,8,Nov,2022
129,Great benefits Good pay Flexible,Experience highly dependent on team,Analyst,9,Nov,2022
130,Great benefits Good pay Flexible,Experience highly dependent on team,Analyst,9,Nov,2022
131,Great Work Culture and People Culture,Salaries could be increased to suit market needs,Manager,8,Nov,2022
132,"Good benefits, okay pay, give you a laptop and a phone if you're into that I guess","High demands, extremely long commute, work culture, demanding supervisors within the company",Web Developer,22,Nov,2022
133,"Very project dependent, but for the most part you are trusted with work and owning your own career.",Hard to see impact go work often due to abstraction from client.,Advisory Consultant,31,Oct,2022
134,Deloitte definitely helped me get into doors to further my career.,They ride you into the ground.,I.T. Support,21,Nov,2022
135,Great benefits and good salary,Large corporation and mandatory trainings,Senior Consultant,8,Nov,2022
136,"- Smart, driven colleagues - Opportunities to progress in career - Relatively high pay and good benefits","- Long hours - Male-dominated culture (especially in M&A side of the house) — as a woman, I sometimes feel tokenized",Strategy Consultant,24,Oct,2022
137,Straightforward onboarding process and easy to seek help.,Corporate atmosphere with little exceptions.,Audit and Assurance,25,Nov,2022
138,"work life balance, work from home","Low pay, hard to find projects",Consultant,26,Nov,2022
139,"I genuinely believe I gained 10 years of experience in the 4 years I have been with the firm. The fast paced work environment will push you to be your very best day in day out. I have been a business analyst, software engineer, cloud architect, and team lead all at once. you'll have the opportunity to be involved in every single aspect of the project here.",long work hours. My friends & family stopped inviting me to events lol,Senior Consultant,27,Sep,2022
140,Take care of their people with tons of benefits,can be stressful and alot of hours during busy season,Senior Tax Consultant,2,Nov,2022
141,Good vacation time in the summer,Bad life during busy season,Audit Manager,6,Nov,2022
142,"Compensation was nothing to fuss about. Most of the time, managers were kind. Always had an opportunity to learn various technologies for free.",The workload is always heavy regardless of the week or time of year. Staffing is always a burden as HR takes super long to allocate. Always working AT LEAST 50 hours. Energy drainage and stress highs become flexed to an all-time level if you cannot manage the abundant workload. The amount of work for one person may not reflect the same amount that another person can do but they do not care about that as they just want you do it without logging over the hours allocated.,RFA Analyst,21,Sep,2022
143,Great company with a lot of opportunities to grow and learn.,Its a huge company and can be difficult to manage.,Consultant,1,Nov,2022
144,"Culture, career advancement, learning and development. People come first.","Complex and matrixed organization - takes time to acclimate to the ecosystem. However, nothing to complain about, it’s an amazing place to work.","Sr. Sales Manager, Consulting ",26,Oct,2022
145,"Lots of different Project Opportunities, Streamlined Campus Recruiting Process, Great company to transition from a STEM education to more a consulting focused career, pays well compared to many other entry-level roles (aside from Tech)","Lots of Red Tape and Processes, Utilization and performance review expectations can be confusing and frustrating to initially understand",Business Technology Analyst,11,Oct,2022
146,People are great and work is very flexible. Can work from home or in the office and work can be around personal schedule,Lots of hours especially around d the tax deadlines,Tax Manager,26,Oct,2022
147,Good benefits for consulting company,The people and culture is very stuffy.,Consultant,3,Nov,2022
148,"Decent salary, great benefits, ability to travel and build travel points, impressive professional versatility.","Unpredictable work projects - e.g. some engagements last weeks, or months; each employee is their own company (with their own brand etc) and greater emphasis is therefore placed on networking. If you're not good at networking, become an expert in a particular field or map out a systematic plan to network.",ERS Consultant,28,May,2015
149,Good learning experience. The benefits are decent.,Long hours of work. No work/life balance.,Tax Consultant II,25,Oct,2022
150,Good learning experience. The benefits are decent.,Long hours of work. No work/life balance.,Tax Consultant II,25,Oct,2022
151,Work with smart committed colleagues,High work hours and culture of overwork,Manager,3,Nov,2022
152,"Deloitte is one of the big-4. Good salay, benefits and competition package","Employees are treated as slaves here. No matter how expert and knowledgeable employees are, they are supposed to learn to say “yes sir” and are expected to work at least 12 hours on average. As soon as you try to suggest something right but that is in conflict, your manager will label you as poor performer. And there is no real HR system in Deloitte.",Manager,5,Nov,2022
153,"1. Tons of opportunities for learning as a professional as there are appropriate resources and help available
2. Strictly process oriented, which in a way helps as you won't miss-out on any mandatory steps in-terms of project delivery
3. Careers coach's available at every level
4. Plenty of PTO days","1. Work-life balance is a big challenge
2. Some of the professionals are from different streams (entirely different profession and not software) so it becomes difficult at times to convince and get the message through",Senior Solution Engineer,23,Aug,2022
154,good experience for jump ship,high stress but high reward,Audit Assistant,4,Nov,2022
155,Great company culture. Really care about the people. Great benefits. Good comp.,No cons and lots of opportunities for learning and development and moving around,Manager,27,Oct,2022
156,Great Training Program Great Benefit + Bonus Good People,Shortage of Human Resources = Busy!! High turnover,Audit Senior Assistant (Second Year),23,Nov,2022
157,"Big clients, good experience, and highly talented people you will work with",Long hours that can affect your sleep schedule - be disciplined with yourself,Senior Associate,28,Oct,2022
158,Great benefits nice managers friendly staff,Poor management heavy hours low 401k,Risk and Financial Advisory,2,Nov,2022
159,Good company culture Great benefits,"Lower pay Red tape, can be very hierarchical",Campus Recruiter,31,Oct,2022
160,Breadth of services Generally well accepted brand Constant efforts to expand capabilities,Very established networks - could be hard to crack the code to get in Hard to serve global accounts Hard to serve diversified accounts with businesses across multiple industries,Principal,14,Oct,2022
161,Good benefits if you have time to take it. Good health benefits,"*Work Life balance is very poor. *Financial intrusion and restriction in personal and family stock investments, and home mortgages since Deloitte is an Audit company but you might not be in the audit line of their business! *Low pay considering all the extra unpaid overtime you have to do. *Deloitte is a consulting company where they pay you a fixed salary but bill the client all the unpaid overtime hours you work. *Extreme micromanagement and useless meetings. *Too political and toxic environment.",Senior Consultant,31,Oct,2022
162,Deloitte is Good to work place,Nothing as such to improve,Consultant,2,Nov,2022
